title,description,url,group,icon,color,visible,media_url,longitude,latitude,maphub_image_url
Ukrainian soldiers held captive in a Russian prisons as POWs,"Date of discovery: 24 April 2022
Province: Rostov Oblast
City/Town/Village: Kamensk-Shakhtinsky

Ukrainian soldiers held captive in general regime colony № 12 in the town of Kamensk-Shakhtinsky without converting the prison to a POW camp, in violation of the Convention on the Treatment of Prisoners of War and its Additional Protocols, adopted in 1977 and 2005.",https://ombudsman.gov.ua/en/news_details/upovnovazhenij-rosiya-utrimuye-ukrayinskih-vijskovopolonenih-u-koloniyah-zagalnogo-rezhimu,POW and Internment camps,campsite,#1b8893,True,,40.265068,48.321081,
Alleged Russian internment camp,"Date of discovery: 25 April 2022
City/Town/Village: Vovchansk

According to Ombudsman Denisova, Russian troops created an internment camp in a factory building.",https://twitter.com/KyivIndependent/status/1518548161706577920,POW and Internment camps,campsite,#1b8893,True,,36.937003,50.292884,
"402,000 ""Evacuation"" of Ukrainians to Russia * not confirmed numbers*","Date of dicovery: 24 March 2022

Russia claims to have 'evacuated' 402,000 Ukrainians to Russia, including 84,000 children. This ""evacuation"" is being assessed as being a forcible transfer of people including children to Russia through harsh filtration camps. Source - Verkhovna Rada Commissioner for Human Rights Lyudmyla Denisova.",https://twitter.com/zminaUkraine/status/1507095685908340744,POW and Internment camps,campsite,#1b8893,True,,37.939213,52.709151,
Russian filtration camp for Ukrainian men,"Date of discovery: 07 May 2022
Province: Donetsk and Kherson Oblasts
City/Town/Village: Bezymenne and Kozatske 

Mayor of Mariupol Vadym Boichenko has stated that around 2,000 men are being held in so-called “filtration centres” in Bezymenne and Kozatske, and not being allowed to return to their homes unless they are sick or injured. “They are being used as labour to clear the rubble, collect the dead bodies of those the Russians have killed, and cover up evidence of war crimes,” Boichenko said in a BBC interview.",https://inews.co.uk/news/putin-mariupol-survivors-remote-corners-russia-investigation-network-camps-1615516,POW and Internment camps,campsite,#1b8893,True,,37.935746,47.107502,
Russian camp for Ukrainian civilians,"Date of discovery: 16 April 2022
Country: Russia
City/Town/Village: Penza

Ukraine’s human rights ombudsman Lyudmyla Denisova has warned that more than 400 people, including 147 children, are in a fenced camp near the city of Penza, according to information she has received from concerned Russian citizens.
After the Second World War, the facility was used as a munitions dump for Soviet chemical bombs and since 2008, it was at the centre of the Russia’s programme to disarm its arsenal of nerve agents including VX and sarin.",https://inews.co.uk/news/mariupol-ukraine-russia-war-leonidovka-putin-1579199,POW and Internment camps,campsite,#1b8893,True,,45.205877,53.119795,
Russian Camp for Ukrainian civilians,"Date of discovery: 07 May 2022
Country: Russia
City/Town/Village: Vladivostok 

Russian local newspaper reported in late April that about 300 Ukrainian civilians, including 86 children, pregnant women and pensioners, arrived in Vladivostok after an exhausting seven-day journey on the Trans-Siberian Express from Taganrog. The new arrivals, including survivors of the Mariupol siege, were taken to the Vostok hotel complex on the coast near Nakhodka. It is assumed that the Ukrainians did not choose to arrive here and were victims of forced deportation during wartime.",https://inews.co.uk/news/putin-mariupol-survivors-remote-corners-russia-investigation-network-camps-1615516,POW and Internment camps,campsite,#1b8893,True,,133.065402,42.767199,
Russian Camp for Ukrainian civilians,"Date of discovery: 16 April 2022
Country: Russia
Province: Leningrad Oblast

Described by the Russian government as a TAP - Temporary accommodation centre, this facility is part of a wide 66 camp network that houses 530 Ukrainians including 120 children from Mariupol, part of which have also been taken to the remote Tsaritsyno Lake boarding camp complex in the Leningrad Oblast - a three-hour drive from St Petersburg.",https://inews.co.uk/news/putin-mariupol-survivors-remote-corners-russia-investigation-network-camps-1615516,POW and Internment camps,campsite,#1b8893,True,,33.499887,59.705401,
Russian Camp for Ukrainian civilians,"Date of discovery: 16 April 2022
Country: Russia
City/Town/Village: Ulyanovsk

Housing survivors of the Mariupol siege include the Vanguard Patriotic Education Centre near Ivanovka in Ulyanovsk. The centre, has a focus on “military-patriotic work” and promoting a “commitment to serving ones Motherland”, opened at the site of a former orphanage in February 2022 as part of a national “education” project.",https://inews.co.uk/news/putin-mariupol-survivors-remote-corners-russia-investigation-network-camps-1615516,POW and Internment camps,campsite,#1b8893,True,,48.101548,54.19595,
Russian Camp for Ukrainian Civilians,"Date of discovery: 07 May 2022
Country: Russia,  Murmansk Oblast
City/Town/Village: Murmashi

Described by the Russian government as a TAP - Temporary accommodation centre, this facility is part of a wide 66 camp network that houses Ukrainians that have been confirmed to or potentially have been forcefully sent there by the Russian Government.",https://inews.co.uk/news/putin-mariupol-survivors-remote-corners-russia-investigation-network-camps-1615516,POW and Internment camps,campsite,#1b8893,True,,32.828136,68.817668,
School converted to a torture chamber by Russian occupants,"Date of discovery: 01 April 2022
Province: Kyiv Oblast,
City/Town/Village: Katiuzhanka

Armed Forces of Ukraine liberated the entire Kyiv Oblast, including Katiuzhanka. The school was used as an HQ for the Russian military to command attacks towards Kyiv and  as a torture chamber by Russian interrogators for POWs and Ukrainian civilians.",https://euromaidanpress.com/2022/05/07/russian-occupation-war-crimes/?swcfpc=1,POW and Internment camps,campsite,#1b8893,True,,30.137348,50.805561,
Prison as a POW and abducted civilian camp for Ukrainians,"Date of Discovery: 30 April 2022
Country: Russia
City/Town/Village: Kursk

Ukrainian men were taken to prison camps, then to ""SIZO I"", a prison in the Russian city of Kursk where it has been reported following a prisoner exchange that Ukrainians were dressed like prisoners, tortured, had their hair cut as well as forced to learn patriotic Russian songs and perform them for their supervisors.  Interrogations took place two or three times a day, after which the men were severely beaten and later forced to sign documents stating that they had been treated well. Reported by Ukrainian Ombudsman Lyudmyla Denisova",https://www.facebook.com/100044138451142/posts/531733271641283/,POW and Internment camps,campsite,#1b8893,True,,36.159657,51.723298,
Russian camp for Ukrainians,"Date of Discovery: 11 April 2022
Country: Russia, Volgograd Oblast
City/Town/Village: Kirovets

240 Ukrainians believed to be held at a camp near Kirovets. Exact geolocation pending",https://inews.co.uk/news/vladimir-putin-ukraine-russia-mariupol-siberia-kremlin-1569431,POW and Internment camps,campsite,#1b8893,True,,44.72887,48.761431,
"Russian ""Filtration camp"" for Ukrainian civilians","Date of Discovery: 17 May 2022
Province: Donetsk Oblast
City/Town/Village: Olenivka

More than 3,000 civilians in Mariupol are being held by Russian forces in a ""filtration prison"" located in former correctional facility № 52 in the village of Olenivka, Donetsk region.",https://www.wsj.com/livecoverage/russia-ukraine-latest-news-2022-05-17/card/russia-holds-3-000-civilians-in-town-where-mariupol-fighters-were-taken-kyiv-says-KBS729yaHhwRNQT3uTOj,POW and Internment camps,campsite,#1b8893,True,,37.648694,47.829391,
Filtration camp for Ukrainians,"Date of Discovery: 11 July 2022
Russian forces are taking Ukrainian civilians from Lysychansk to the filtration camps in occupied Kadiivka.

- Human rights Ombudwomen for the Ukrainian Verkhovna Rada Lyudmila Denisova.",https://t.me/denisova_liudmyla/6569,POW and Internment camps,campsite,#1b8893,True,,38.649985,48.559597,
Ukrainian soldiers held captive in a Russian prisons as POWs,"Date of Discovery: 24 April 2022
Province: Rostov Oblast
City/Town/Village: Zverevo

Ukrainian soldiers held captive in general regime colony № 12 in the town of Kamensk-Shakhtinsky without converting the prison to a POW camp in violation of the Convention on the Treatment of Prisoners of War and its Additional Protocols, adopted in 1977 and 2005, according to Ukraine Ombudsman office.",https://ombudsman.gov.ua/en/news_details/upovnovazhenij-rosiya-utrimuye-ukrayinskih-vijskovopolonenih-u-koloniyah-zagalnogo-rezhimu,POW and Internment camps,campsite,#1b8893,True,,40.269,48.3141,
Russian prison/detention centre used for Ukrainian POWs,"Date of discovery - 02 May 2022
Country: Russia, Volgograd Oblast
City/Town/Village: Kamyshin

The website publishes a letter from someone in the city, where the SIZO [Detention Centre] No. 2, is located, on 38 Rabochaya Street, Kamyshin.
""I live in Taganrog, SIZO-2 in Taganrog is also occupied by Ukrainian prisoners of war. I am attaching a photo. Near the pre-trial detention center now there are constantly similar cars (with a Z-swastika),"" the resident writes.",https://www.gulagu.net/concentration_camps/2022-04-23-1278.html,POW and Internment camps,campsite,#1b8893,True,,45.396027,50.086833,
Russian prison/detention centre used for Ukrainian POWs,"Date of discovery - 10 July 2022
Country: Russia, Volgograd Oblast
City/Town/Village: Surovikino

IK [Correctional Colony] No. 19 - 99 Ordzhonikidze Street, Surovikino - POWs apparently held in remand facilities within colony, which had been emptied of Russian detainees, according to a former member of the local Public Monitoring Commission.",https://www.svoboda.org/a/esli-rasstrel-to-budet-rasstrel-v-kakih-usloviyah-soderzhat-plennyh/31932771.html,POW and Internment camps,campsite,#1b8893,True,,42.876393,48.608734,
Russian prison/detention centre used for Ukrainian POWs,"Date of discovery: 24 April 2022
Country: Russia, Tula Oblast
City/Town/Village: Komsomolsky mikrorayon, Donskoy

IK [Correctional Colony] No. 1, Dimitrova proyezd 1, mikrorayon Komsomolsky, Donskoy - remand facilities within colony apparently emptied to make room for 100 POWs.",https://www.gulagu.net/concentration_camps/2022-04-23-1278.html,POW and Internment camps,campsite,#1b8893,True,,38.265459,53.912327,
Russian prison/detention centre used for Ukrainian POWs,"Date of discovery: 23 April 2022
Country: Russia, Rostov Oblast
City/Town/Village: Taganrog

Address: SIZO [Detention Centre] No. 2 - 175 Lenina Street, Taganrog.",https://www.svoboda.org/a/esli-rasstrel-to-budet-rasstrel-v-kakih-usloviyah-soderzhat-plennyh/31932771.html,POW and Internment camps,campsite,#1b8893,True,,38.907233,47.229529,
Russian prison/detention centre used for Ukrainian POWs,"Date of discovery: 22 April 2022
Country: Russia, Smolensk Oblast
City/Town/Village: Vyzama

Address: SIZO [Detention Centre] No. 2 - 9 Dmitrova Gora Street.",https://www.gulagu.net/concentration_camps/2022-04-23-1278.html,POW and Internment camps,campsite,#1b8893,True,,34.300392,55.218451,
Russian prison/detention centre used for Ukrainian POWs,"Date of discovery: 11 April 2022
Country: Russia, Bryansk Oblast
City/Town/Village: Novozybkov

SIZO [Detention Centre] No. 2, Krasnaya ploshchad 9, Novozybkov",https://www.gulagu.net/concentration_camps/2022-04-23-1278.html,POW and Internment camps,campsite,#1b8893,True,,31.922079,52.541164,
Former Ukrainian detention centre used as POW camp by Russian forces,"Date of discovery: -
Province: Donetsk Oblast
City/Town/Village: -

Pre-trial Detention Centre on Chervonoarmiiska street.",,POW and Internment camps,campsite,#1b8893,True,,37.800966,47.986388,
Former cultural centre used as POW camp,"Date of discovery: -
Province: Donetsk Oblast
City/Town/Village: Donetsk

""Izolyatsiya"" - a former industrial plant used as a cultural centre until its occupation by DNR forces in 2014 - used for the detention of prisoners of a high ""level of danger"", including Ukrainian military, police officers, and local government officials (according to Petro Andrushchenko, advisor to mayor of Mariupol).",,POW and Internment camps,campsite,#1b8893,True,,37.834013,47.964143,
Former Ukrainian detention centre used as POW camp by Russian forces,"Date of discovery: 19 May 2022
Province: Donetsk Oblast
City/Town/Village: Makiivka

Correctional Colony No. 97 used for detention of Ukrainian solders",https://www.currenttime.tv/a/31857911.html,POW and Internment camps,campsite,#1b8893,True,,37.843804,48.04607,
Former Ukrainian detention centre used as POW camp by Russian forces,"Date of discovery: 25 August 2022
Province: Donetsk Oblast
City/Town/Village: Makiivka

Correctional Colony No. 32 - possibly used for detention of Ukrainian soldiers",https://hub.conflictobservatory.org/portal/sharing/rest/content/items/7d1c90eb89d3446f9e708b87b69ad0d8/data,POW and Internment camps,campsite,#1b8893,True,,37.920513,48.095401,
Russian prison/detention centre used for Ukrainian POWs,"Date of discovery: 13 August 2022
Country: Russia, Belgorod Oblast
City/Town/Village: Stary Oskol

SIZO [Detention Centre] No. 2, Stary Oskol - border guards from Snake Island detained here.",https://nv.ua/ukraine/events/svyashchennik-pcu-o-pytkah-v-rossiyskom-plenu-rasskaz-vasiliya-vyrozuba-novosti-ukrainy-50261805.html,POW and Internment camps,campsite,#1b8893,True,,37.841016,51.29305,
Russian pre-trial detention centre,"Date of discovery: 18 May 2022
Country: Russia, Ryazan Oblast
City/Town/Village: Ryazhka

SIZO [Detention Centre] No. 2, 1a Krasnaya Street, Ryazhka - according to Current Time's sources, 219 Ukrainians, including civilians, were detained here (unknown for how long); Russian Federal Prison Service would not confirm presence of Ukrainians. Article 49 of the Geneva Conventions states that ""Individual or mass forcible transfers, as well as deportations of protected persons from occupied territory to the territory of the Occupying Power or to that of any other country, occupied or not, are prohibited, regardless of their motive"".",https://www.currenttime.tv/a/ukraintsy-v-sizo-rossii/31856366.html,POW and Internment camps,campsite,#1b8893,True,,40.063427,53.70365,
Russian pre-trial detention centre,"Date of discovery: 26 April 2022
Country: Russia, Tver Oblast
City/Town/Village: Kashin

SIZO [Detention Centre] No. 2 on 31 Krasnaya Street - local Russian news site reported that detention centre had been closed so it could be used by the Russian Defence Ministry for prisoners of war. On 4 August, local Telegram channel Zakroy za mnoy Tver reported that the presence of c. 200 Ukrainian soldiers had been confirmed by multiple FSIN [Federal Prison Service] employees. Under Russian law, people may only be placed in a pre-trial detention centre if this has been ordered by a court.",,POW and Internment camps,campsite,#1b8893,True,,37.608851,57.371881,
Former correctional colony in Russian-occupied area,"Date of discovery: 02 June 2022
Province: Donetsk Oblast
City/Town/Vuillage: Molodizhne

Ukrainian POWs and civilians held in Volnovakha Correctional Colony No. 120, Molodizhne, nr. Olenivka.",https://t.me/andriyshTime/1217,POW and Internment camps,campsite,#1b8893,True,,37.711459,47.825906,
Former correctional colony in Russian-occupied area,"Date of discovery:  15 May 2022
Province: Donetsk Oblast
City/Town/Village: Olenivka 

Yenakiyeve Correctional Colony No. 52, Yaltinska Street / 2a Yaltinskaya Street, Olenivka, Yenakiyeve. Used for detention of non-active-duty military personnel, law enforcement officers, activists and journalists.  There seems to be some confusion, both in the media and on the MapHub map, over the exact locations of a prison in Olenivka. There are two places in Donetsk Oblast called Olenivka, both of which have a correctional colony - one in Volnovakha District, south of Donetsk city (No. 120) and one near the town of Yenakiyeve, north-east of Donetsk city. Both have been used to detain Ukrainians. No. 120 was the one which was bombed on 29 July.",https://t.me/andriyshTime/819,POW and Internment camps,campsite,#1b8893,True,,38.255367,48.265527,
Holding camp in house of culture,"Date of discovery: 05 April 2022 
Province: Donetsk Oblast
City/Town/Village: Dokuchayevsk

House of Culture and Leisure used as holding facility for Ukrainian civilians from Mariupol awaiting registration as part of the ""filtration"" process (which could take place in the same location). Witnesses describe overcrowded and unsanitary conditions.",https://hub.conflictobservatory.org/portal/sharing/rest/content/items/7d1c90eb89d3446f9e708b87b69ad0d8/data,POW and Internment camps,campsite,#1b8893,True,,37.676811,47.746036,
Holding camp in school,"Date of discovery: 04 May 2022 
Province: Donetsk Oblast
City/Town/Village: Kozatske, Novoazovsky District

Chelyuskinska School (1 Shkilna Street, Kozatske) used to hold men from Mariupol for periods from days to weeks. Witnesses describe beatings by guards and illness among detainees.",https://hub.conflictobservatory.org/portal/sharing/rest/content/items/7d1c90eb89d3446f9e708b87b69ad0d8/data,POW and Internment camps,campsite,#1b8893,True,,37.978836,47.23778,
Civilians detained for filtration at (former) police station,"Date of discovery: 17 March 2022
Province: Donetsk Oblast
City/Town/Village: Manhush

Local residents obliged to pass ""filtration"" at former Manhush police station (63 Tytova Street - now used by Ministry of Internal Affairs of self-proclaimed DNR) or at nearby checkpoint in order to obtain right of free movement in the region; people could be held for 1-2 days in overcrowded cells and have described beatings and insufficient food.",https://hub.conflictobservatory.org/portal/sharing/rest/content/items/7d1c90eb89d3446f9e708b87b69ad0d8/data,POW and Internment camps,campsite,#1b8893,True,,37.311064,47.056505,
Holding centre at school for those undergoing filtration,"Date of discovery: 15 April 2022
Province: Donetsk Oblast
City/Town/Village: Novoazovsk

Civilians held for filtration in School No. 1, 2, and/or 3 in Novoazovsk - unclear which (Coordinates available for No. 1). One witness reported being held for two days without food and that people who resisted detainment  were beaten.",https://hub.conflictobservatory.org/portal/sharing/rest/content/items/7d1c90eb89d3446f9e708b87b69ad0d8/data,POW and Internment camps,campsite,#1b8893,True,,38.08461,47.110942,
Detention centre in Russian-occupied area,"Date of discovery : 07 April 2022
Province: Lunahsk Oblast
City/Town/Village: Luhansk

Izvestiya reported that Ukrainian soldiers who had ""voluntarily laid down arms"" were being held in the SIZO [Detention Centre] in Luhansk. Ukrainian independent outlet slidstvo.info noted on 10 June that the site is being used to hold people who have not passed ""filtration"".",https://www.slidstvo.info/news/rosiyany-oblashtuvaly-na-donbasi-16-filtratsijnyh-punktiv-ta-7-tyurem-dlya-ukrayintsiv-karta/,POW and Internment camps,campsite,#1b8893,True,,39.331322,48.574063,
Russian prison/detention centre used for Ukrainian POWs,"Date of discovery: 21 September 2022
Country: Russia, Voronezh Oblast
City/Town/Village: Borisoglebsk

SIZO [Detention Centre] No. 2, 39 Sovetskaya Street: a source in the Russian prison service (FSIN) told Gulagu.net that there are over 250 POWs being held here and in Correctional Colony No. 9 ""without legal status"". The source shared a letter from the commander of the Voronezh garrison to the acting head of the Voronezh Oblast FSIN branch asking him to assign vehicles and drivers to transport ""119 people who showed opposition to the carrying out by the Russian Federation of a special military operation on the territory of Ukraine"" from the Baltimor aerodrome in Voronezh to SIZO No. 2.",https://t.me/NetGulagu/3345,POW and Internment camps,campsite,#1b8893,True,,42.078786,51.368339,
Russian prison/detention centre used for Ukrainian POWs,"Date of discovery: 21 September 2022
Country: Russia, Voronezh Oblast
City/Town/Village: Borisoglebsk

IK [Correctional Colony] No. 9, 40 let Oktyabrya Street: a source in the Russian prison service (FSIN) told Gulagu.net that there are over 250 POWs being held here and in SIZO [Detention Centre] No. 2 ""without legal status"".",https://t.me/NetGulagu/3345,POW and Internment camps,campsite,#1b8893,True,,42.135937,51.355327,
Russian/Russian-backed forces used Ukrainian police station for detention and torture of civilians in occupied area,"Date of discovery: 28 September 2022
Province: Kharkiv Oblast
City/Town/Village: Kupiansk

Kupiansk District Police Department on 14 Kharkivska Street: Russian forces detained civilians in overcrowded cells, sometimes handcuffing them; a witness described to Mediazona how detainees were electrocuted, beaten, and given little food and water.",https://en.zona.media/article/2022/09/27/wrecked,POW and Internment camps,campsite,#1b8893,True,,37.609744,49.710759,
Russian/Russian-backed forces use Ukrainian police station for detention and torture of civilians in occupied area,"Date of discovery: 23 September 2022
Province: Kharkiv Oblast
City/Town/Village: Balakliya

Balakliya District Police Department, on 33 Zhovtena Street : Russian forcesdetained civilians they believed had served in or had connections to Ukraine's Anti-Terrorist Operation in Donbas (since 2014); they kept them in overcrowded cells and tortured them with electric shocks during interrogation.",https://en.zona.media/article/2022/09/23/occupation,POW and Internment camps,campsite,#1b8893,True,,36.843802,49.452076,
Russian/Russian-backed forces used building of Ukrainian publishing house for detention and torture of civilians in occupied area,"Date of discovery: 16 September 2022
Province: Kharkiv Oblast
City/Town/Village: Balakliya

Baldruk Publishing House on 14 Zhovtena Street: Russian forces detained civilians in this building opposite the police station; Igor Klimenko, head of Ukraine's police force, said that detainees were kept inside transparent boxes usually used in courtrooms, and that there is evidence of torture.",https://interfax.com.ua/news/general/859296.html,POW and Internment camps,campsite,#1b8893,True,,36.843103,49.45223,
Russian forces used Ukrainian police building for detention and torture of civilians in occupied area,"Date of discovery: 19 September 2022
Province: Kharkiv Oblast
City/Town/Village: Izyum

Izyum Department of the Main Directorate of the Ministry of Internal Affairs for Kharkiv Oblast, Provulok Heorhiyivsky 4: Russian forces detained and tortured civilians in the police station.",https://www.facebook.com/permalink.php?story_fbid=pfbid04FqnPmtzuDwmFz72eouvb4anwftoaZR6qdRAmtZxgauhVSCzykbsDj9t4W4RHc4Jl&id=100002276907245,POW and Internment camps,campsite,#1b8893,True,,37.274974,49.186454,
Russian forces used Ukrainian school building for detention and torture of soldiers and civilians in occupied area,"Date of discovery: 02 October 2022
Province: Kharkiv Oblast
City/Town/Village: Izyum

Izyum School No. 2, on 12 Ivana Miroshnichenka Street: Russian troops detained Ukrainian soldiers and civilians in the school building, which they also used as a base and field hospital; one captured Ukrainian soldier described to AP how he was beaten, and said that at least two civilians died there.",https://apnews.com/article/russia-ukraine-business-treatment-of-prisoners-government-and-politics-aec9afe8d6631795ae9f9478a4ede4cc,POW and Internment camps,campsite,#1b8893,True,,37.268012,49.220661,
Russian forces used Ukrainian polyclinic premises for detention and torture of civilians in occupied area,"Date of discovery: 19 September 2022
Province: Kharkiv Oblast
City/Town/Village: Izyum

Izyum City Railway Polyclinic on 35 Zavodska Street: Russian troops detained Ukrainian soldiers and civilians inside crowded, windowless garages at the polyclinic; Ukrainian intelligence officials have said that women were raped there; two captured Ukrainian soldiers separately described to Associated Press how they heard women's screams and were themselves tortured.",https://apnews.com/article/russia-ukraine-business-treatment-of-prisoners-government-and-politics-aec9afe8d6631795ae9f9478a4ede4cc,POW and Internment camps,campsite,#1b8893,True,,37.300057,49.22025,
Russian forces held civilians in a pit on a residential property,"Date of discovery: 19 September 2022
Province: Kharkiv Oblast
City/Town/Village: Izyum

Russian troops detained and tortured civilians at a residential property (precise location unclear - estimates based on Associated Press map).",https://apnews.com/article/russia-ukraine-business-treatment-of-prisoners-government-and-politics-aec9afe8d6631795ae9f9478a4ede4cc,POW and Internment camps,campsite,#1b8893,True,,37.284815,49.202611,
Russian forces held civilians in a cellar on a residential property,"Date of discovery: 19 September 2022
Province: Kharkiv Oblast
City/Town/Village: Izyum

Russian troops detained and tortured civilians at a residential property (precise location unclear - estimates based on Associated Press map).",https://apnews.com/article/russia-ukraine-business-treatment-of-prisoners-government-and-politics-aec9afe8d6631795ae9f9478a4ede4cc,POW and Internment camps,campsite,#1b8893,True,,37.340893,49.194445,
