title,description,url,group,icon,color,visible,media_url,longitude,latitude,maphub_image_url
Strike on industrial area,"Date of discovery: 17 November 2022
Province: Dnipropetrovsk Oblast
City/ Town/ Village: Dnipro

In Dnipro, 14 multi-storey buildings and an industrial enterprise were damaged and two fires broke out as a result of Russian missile attack. More details [here](
https://www.ukrinform.net/rubric-ato/3616879-missile-strike-on-dnipro-enterprise-14-multistorey-buildings-damaged.html).",https://adm.dp.gov.ua/news/infarkt-kontuziyi-porizi-u-lyudej-ta-ponad-desyat-poshkodzhenih-bagatopoverhivok-dnipro-ogovtuyetsya-vid-rankovogo-obstrilu?fbclid=IwAR0oDB3Fn11NSd9IhdVelUPeNTZFh3JVhqvLAtFQv0uLmwo_eBUlbrG8sEM,Aerial and Artillery strikes targeting the civilian population,,,True,,34.983341,48.450403,
Strike on city,"Date of discovery: 20 November 2022
Province: Donetsk Oblast
City/ Town/ Village: Adiivka

Russian troops have struck the central part of the Donetsk region’s Avdiivka with the Grad multiple launch rocket systems (MLRS). No casualties among civilians were reported. More details [here](
https://www.ukrinform.net/rubric-ato/3618252-russians-strike-central-part-of-avdiivka-with-grad-mlrs.html).",https://t.me/pavlokyrylenko_donoda/5588,Aerial and Artillery strikes targeting the civilian population,,,True,,37.749134,48.136596,
Strike on residential area injures six,"Date of discovery: 26 November 2022
Province: Dnipropetrovsk Oblast
City/ Town/ Village: Dnipro

Explosions in Dnipro. Currently, seven private houses were partially destroyed. An explosion caused a fire. Six people have been injured. More details [here](
https://www.ukrinform.net/rubric-ato/3622459-seven-buildings-partially-destroyed-six-people-injured-in-missile-strike-on-dnipro.html).",https://www.facebook.com/PoliceDniproRegion/posts/2210362535791055,Aerial and Artillery strikes targeting the civilian population,,#3cc954,True,,34.983854,48.450281,
Shelling of residential area,"Date of discovery: 01 February 2023
Province: Donetsk Oblast
City/Town/Village: Bakhmut

Several residential buildings, as well as shops, have been damaged due to artillery shelling in the city centre. No casualties were reported.",https://www.facebook.com/OlexiyRevaOfficial/posts/pfbid0Fai1TiNdQ8vQNU7PPB7Evgp66SMNaVGjDb2wW6wdEa4Q94S37Rbp1QaQcYdWCsRTl,Aerial and Artillery strikes targeting the civilian population,,#f65c60,True,,38.004264,48.587141,https://maphub.net/media/images/h/i4/hi4qoe6sxuh1hdh1/1856_1392.jpg
Bombing on civilian infrastructure,"Date of discovery: 02 January 2023
City/ Town/ Village: Kramatorsk

Strikes have been reported in the industrial area as well as a cemetery. Two S-300 missiles and an Iskander-K missile were used in the attack. 10 residential buildings have been hit. Civilian casualties have been reported.",https://dn.npu.gov.ua/news/raketnyi-teror-rosii-na-donechchyni-politsiia-zadokumentuvala-vtraty-ta-ruinuvannia-za-dobu,Aerial and Artillery strikes targeting the civilian population,,#f65c60,True,,37.608152,48.742401,https://maphub.net/media/images/w/v8/wv8yvqbshr8itjzc/1024_768.jpg
Industrial area hit by bombing,"Date of discovery: 02 January 2023
City/ Town/ Village:Druzhkivka

The industrial area in Druzhkivka has been hit by an S-300 missile. No casualties have been reported.",https://dn.npu.gov.ua/news/raketnyi-teror-rosii-na-donechchyni-politsiia-zadokumentuvala-vtraty-ta-ruinuvannia-za-dobu,Aerial and Artillery strikes targeting the civilian population,,#f65c60,True,,37.53443,48.618997,
Bombing of infrastructure,"Date of discovery: 01 February 2023
City/ Town/ Village: Velika Novosilka

Velika Novosilka has been bombarded, resulting in damage of infrastructure.",https://dn.npu.gov.ua/news/raketnyi-teror-rosii-na-donechchyni-politsiia-zadokumentuvala-vtraty-ta-ruinuvannia-za-dobu,Aerial and Artillery strikes targeting the civilian population,,#f65c60,True,,36.838881,47.843615,
Bombing of city centre,"Date of discovery: 01 February 2023
City/ Town/ Village: Kramatorsk

The city has been targeted by a missile attack in the middle of the night resulting in the death of 2 people and the wounding of 8 in varied degrees of severity.",https://www.facebook.com/story.php?story_fbid=pfbid02jCpSJPo9JtqcoEaiW5aSYVzyCCwQG9B5n55zfRfxWmJFRTzeRkrM7NQJWMRtu8hNl&id=100064700647939,Aerial and Artillery strikes targeting the civilian population,,#f65c60,True,,37.5417,48.725008,https://maphub.net/media/images/r/sh/rshlr1jmbzvio7gr/1344_1008.jpg
Shelling of residential area,"Date of discovery:02 February 2023
City/ Town/ Village: Kupiansk

The shelling of a residential area has led to a 60-year-old man being buried under rubble. The man survived and was provided with medical aid. The remains of a 152 mm artillery shell have been found on site.",https://www.facebook.com/police.kharkov/posts/pfbid0tUgQxE3Ye38ytXkQXxZweA3yqJAR8EfapoKYEtyAMKvGn1e9Srte55cdH7MARxGTl,Aerial and Artillery strikes targeting the civilian population,,#f65c60,True,,37.614301,49.693545,https://maphub.net/media/images/l/oh/lohgp9lcphvgnakj/1856_1392.jpg
Uncovered body of shelling victim,"Date of discovery: 02 January 2023
Province: Mykolaiv Oblast
City/Town/Village: Myrne

A body of a 37-year-old male victim of an artillery strike who died in the spring of 2022 has been uncovered.",https://www.facebook.com/UA.National.Police.Nikolaev/posts/pfbid02gfAeBd2wzWTPU3g457KV3yWXaLppwK3F2HubtAaaQm9MHLJNBTueiLvopYUCkLRSl,Aerial and Artillery strikes targeting the civilian population,,#f65c60,True,,32.311533,46.810596,https://maphub.net/media/images/6/nr/6nrmlrik3nmj4llh/768_576.jpg
Shelling of private enterprise,"Date of discovery: 01 February 2023
Province: Donetsk Oblast
City/Town/Village: Sloviansk

A private enterprise was hit by an S-300 missile. The shop and two cars have been destroyed. No casualties have been reported.",https://www.facebook.com/vadymlyah/posts/3258585917724919,Aerial and Artillery strikes targeting the civilian population,,#f65c60,True,,37.590094,48.847184,https://maphub.net/media/images/j/re/jre06dwd2ykeq8np/1856_1392.jpg
Shelling of residential area,"Date of discovery: 01 February 2023
City/ Town/ Village: Zamist

At 10:00 the village of Zamist was hit by MLRS fire. A residential building, as well as a gas pipeline and cars, have been hit. One civilian was injured.",https://www.facebook.com/story.php?story_fbid=pfbid02N1DqJZEcoBwVdmAuNuEDfW38RkwJ6bv4Xq7GMoH3h5RMEsozUBEk2ihg7hJLi6Cyl&id=100064541775905,Aerial and Artillery strikes targeting the civilian population,,#f65c60,True,,37.401739,50.074468,https://maphub.net/media/images/n/qk/nqkypzdnteqigfke/1856_1392.jpg
Shelling of residential area,"Date of discovery: 02 February 2023
Region: Kherson Oblast
City/ Town/ Village: Kherson 

The central part of the city was shelled at night, resulting in damage to houses and the death of one person.",https://t.me/khersonskaODA/3472,Aerial and Artillery strikes targeting the civilian population,,#f65c60,True,,32.614114,46.64203,
S-300 bombardment of residential area,"Date of discovery: 02 February 2023
City/ Town/ Village: Kramatorsk

A residential area in Kramatorsk has been hit by two S-300 missiles at around 12:20. As a result, the area has been heavily damaged and 6 civilians have been wounded.",https://www.youtube.com/watch?v=X7KmT16wojA,Aerial and Artillery strikes targeting the civilian population,,#f65c60,True,https://www.youtube.com/watch?v=X7KmT16wojA,37.597701,48.718062,
Bodies found after bombardament,"Date of discovery: 02 February 2023
Region: Donetsk Oblast
City/ Town/ Village: Kramatorsk

A rescue operation has uncovered the bodies of 3 civilians from the rubble following a bombardment of the town. 2 more people have been rescued.",https://www.facebook.com/DSNSDon/videos/710485790528403/,Aerial and Artillery strikes targeting the civilian population,,#f65c60,True,,37.603581,48.723331,
Rocket strike on Kramatorsk,"Date of discovery: 02 February 2023
Region: Donetsk Oblast
City/ Town/ Village: Kramatorsk

The centre of the town has been bombarded resulting in 18 injured, the partial collapse of a residential building, and further damage to 10 other residential buildings.",https://www.youtube.com/watch?v=ey7NLbf0Mdc,Aerial and Artillery strikes targeting the civilian population,,#f65c60,True,https://www.youtube.com/watch?v=ey7NLbf0Mdc,37.539657,48.724183,
Shelling of residential area,"Date of discovery: 03 February 2023
City/ Town/ Village: Velykyi Burluk

The town has been shelled with anti-aircraft missiles at around 9:20 p.m. Damage has been done to residential and farm buildings as well as cars. No casualties have been reported.",https://www.facebook.com/prokuraturakharkiv/posts/pfbid0qdzXzJpiBKkVhsh2deCjc5i18JRk6YJUcciVepE6xduicQYcYJCTcZTFuaDYhmYSl,Aerial and Artillery strikes targeting the civilian population,,#f65c60,True,,37.386468,50.057934,
Artillery barrage on Kupyansk,"Date of discovery: 04 February 2023
Region: Kharkiv Oblast
City/ Town/ Village: Kupyansk

The city has been bombarded by a Uragan rocket strike at around 11:00 a.m. Due to this, a boiler room of one of the administrative buildings of one of the enterprises was destroyed.",https://www.facebook.com/prokuraturakharkiv/posts/pfbid0qdzXzJpiBKkVhsh2deCjc5i18JRk6YJUcciVepE6xduicQYcYJCTcZTFuaDYhmYSl,Aerial and Artillery strikes targeting the civilian population,,#f65c60,True,,37.610986,49.72218,
Shelling causes damage to residential houses,"Date of discovery: 03 February 2023
City/ Town/ Village: Vovchansk

The shelling of the town has caused damage to residential buildings and stores.",https://www.facebook.com/prokuraturakharkiv/posts/pfbid0qdzXzJpiBKkVhsh2deCjc5i18JRk6YJUcciVepE6xduicQYcYJCTcZTFuaDYhmYSl,Aerial and Artillery strikes targeting the civilian population,,#f65c60,True,,36.941138,50.28593,
1 dead and 6 injured in shelling,"Date of discovery: 03 February 2023
City/Town/ Village: Toretsk 

The city of Toretsk was shelled by ''Grad'' salvo rocket systems, hitting residential buildings, a shop, and cars resulting in the death of one elderly person and injuring 9 others.",https://www.facebook.com/don.gp.gov.ua/posts/pfbid0jXw44nhAj6BStUW6suxHiTdMHeoHtWoWjkFw7q66dNtAPvBYEtGDpxWz8S63x6utl,Aerial and Artillery strikes targeting the civilian population,,#f65c60,True,,37.860787,48.393232,https://maphub.net/media/images/v/2m/v2mffzfv05sydxrn/1856_1392.jpg
Artillery shelling injures civlians,"Date of discovery: 03 February 2023
Region: Donetsk Oblast
City/ Town/ Village: Kurakhivka

Artillery shelling of the village has left 3 civilians, two women and one man, injured.",https://www.facebook.com/don.gp.gov.ua/posts/pfbid0jXw44nhAj6BStUW6suxHiTdMHeoHtWoWjkFw7q66dNtAPvBYEtGDpxWz8S63x6utl,Aerial and Artillery strikes targeting the civilian population,,#f65c60,True,,37.372528,48.025871,
Wounded civilians as a result of shelling,"Date of discovery: 03 February 2023
City/ Town/ Village: Toretsk 

Two people were injured due to shelling of the city.",https://www.facebook.com/DSNSDon/posts/pfbid0wjqFQUtJR4jAo3KLn4KZgdN1Dw9PG7UwwYXUMUX4DuyTCoiwAiBTJdas62tkiH9Ll,Aerial and Artillery strikes targeting the civilian population,,#f65c60,True,,37.858934,48.397888,https://maphub.net/media/images/g/wn/gwnjgrqjt6vm31uc/1344_1008.jpg
Shelling of village with cluster charges,"Date of discovery: 02 February 2023
Region: Cherson Oblast
City/ Town/ Village: Tavriyske

The village has been shelled from the ''Uragan'' anti-aircraft missile system with cluster-charged shells. No casualties reported.",https://zp.npu.gov.ua/news/30-obstrilianykh-naselenykh-punktiv-na-zaporizhzhi-pravookhorontsi-vidkryly-kryminalni-provadzhennia,Aerial and Artillery strikes targeting the civilian population,,#f65c60,True,,33.332109,46.854162,
Shelling of medical facility and school,"Date of discovery: 03 February 2023
Region: Zaporizhia Oblast
City/ Town/ Village: Orichov

The town has been shelled, resulting in a direct hit on a medical facility building and a damaged school",https://www.facebook.com/zoda.gov.ua/posts/pfbid035ryEt6WPZirudv11JmmX7CeY7XvNwWihzcKH2sMqM8sbMvA9Q73DkwzfDt1sey8dl,Aerial and Artillery strikes targeting the civilian population,,#f65c60,True,,35.786159,47.567194,
Shelling of residential areas with high-explosive cluster munition,"Date of discovery: 03 February 2023
Region: Donetsk Oblast
City/ Town/ Village: Pokrovsk

The town has been shelled by ''Uragan'' multiple-launch rocket systems and artillery weapons with high-explosive cluster munition. The park and residential areas came under fire. The shelling resulted in damage to around 30 residential houses and commercial buildings, power lines, and civilian vehicles.",https://www.facebook.com/don.gp.gov.ua/posts/pfbid02U98zjXCL2jHeY9Zg29KeH7hUD5Cdg8N5XFCPHcjLhHjLYwkndnhYAMnsov9eWENFl,Aerial and Artillery strikes targeting the civilian population,,#f65c60,True,,37.176901,48.266729,
Shelling results in fires,"Date of discovery: 03 February 2023
Region: Kherson Oblast
City/ Town/ Village: Kherson

Night strikes have set fire to the warehouses of one of the shopping centres. The fire has spread to the department with pyrotechnic products, resulting in additonal explosions. No casualties have been reported.",https://www.facebook.com/DSNSKHERSON/posts/pfbid0D6Sd5hHeYPDJXCLY46f53zsXVZvM6vxLLahKWeana81Dwmd2n96hbe8YEECNrVW8l,Aerial and Artillery strikes targeting the civilian population,,#f65c60,True,,32.595956,46.650745,
Artillery shelling of local disctricts,"Date of discovery: 04 February 2023
Region: Kherson Oblast
City/ Town/ Village: Kherson

Several districts have been hit by mortars and MLRS systems, resulting in damage to residential buildings as well as shops and industrial buildings. 1 civilian has been killed and several were wounded.",https://www.facebook.com/khersonpolice.official/posts/pfbid0X79VrtMw1C1hDUDr2hbmjo21mGunM9vxwnTLy1WVduU28bgvHuwoUX7QsxpwhnX2l,Aerial and Artillery strikes targeting the civilian population,,#f65c60,True,,32.595336,46.629728,
Artillery shelling of residential area,"Date of discovery: 01 February 2023
Province: Donetsk Oblast
City/Town/Village: Bakhmut

A residential area has been hit, resulting in a fire in one of the houses. No casualties were reported.",https://www.facebook.com/DSNSDon/posts/pfbid0uHy99DV4To9ZDRpZMdpgac6LSP2TvgVfRsPoYSUuJkWS7vANuoYUvoSWPoFcnUMNl,Aerial and Artillery strikes targeting the civilian population,,#f65c60,True,,37.994158,48.591134,
Fires due to artillery strikes,"Date of discovery: 04 February 2023
City/Town/Village: Bakhmut

Several fires have broken out due to artillery strikes on the city. 8 apartments and other residential buildings have caught fire. No information has been provided on any casualties or injuries.",https://www.facebook.com/DSNSDon/posts/pfbid0GUuscmLQMmyEUwx2b7gseSMWLUVECfM3Dk16t8CnzeS8cyvC2pcL8u3UzXaC5Y6Xl,Aerial and Artillery strikes targeting the civilian population,,#f65c60,True,,37.998024,48.588157,
Shelling of residential area,"Date of discovery: 05 February 2023
City/ Town/ Village: Kupyansk

Administration building of the medical institution and private residential buildings were damaged due to shelling.",https://www.facebook.com/synegubov.oleg/posts/pfbid02r2P1RsHSuEqXSEwJFzyV7pDAA4sxjYSMQvoRttCUQVVk2NH4o8BDdWg5DGqXX71Wl,Aerial and Artillery strikes targeting the civilian population,,#f65c60,True,,37.613927,49.714951,
Artillery shelling of residential area,"Date of discovery: 05 February 2023
Province: Kherson Oblast
City/Town/Village: Chornobaivka

Artillery shelling has resulted in heavy damage to residential areas, damaging 6 houses, communication lines, power lines, gas pipelines, and water pipelines. One person was injured.",https://t.me/khersonskaODA/3546,Aerial and Artillery strikes targeting the civilian population,,#f65c60,True,,32.557361,46.694615,
Rocket attacks on residential areas,"Date of discovery: 05 February 2023
City/ Town/ Village: Druzhkivka

With the use of an S-300 anti-aircraft missile system, the city of Druzhkivka has been shelled. The attack injured 5 civilians and destroyed several residential buildings.",https://www.facebook.com/don.gp.gov.ua/posts/pfbid0stVtSVjPacgi9HtpHmMPpsLATu7kz12iGVvfaCEkWCsJB3HK2enKa1QtueyRDGSdl,Aerial and Artillery strikes targeting the civilian population,,#f65c60,True,,37.533256,48.607135,
Shelling of residential area and educational institution,"Date of discovery: 05 February 2023
Province: Kharkiv Oblast
City/Town/Village: Kharkiv

The Kyiv district has been shelled by  S-300 rockets. A rocket hit a five-story building of a higher education institution, thereby injuring the guard. Furthermore, another rocket hit a nearby residential building, thereby injuring 4 civilians.",https://www.facebook.com/prokuraturakharkiv/posts/pfbid02mfT1RFgJxc6FuepgnD81keqLCANLAsAViw53khbvSNyrmArteGsQxNRXhVUVT3dAl,Aerial and Artillery strikes targeting the civilian population,,#f65c60,True,,36.245682,50.005064,https://maphub.net/media/images/x/tb/xtbhicotkh0bbbbj/1856_1392.jpg
Shipbuilder Lyceum shelled,"Date of discovery: 05 February 2023
Region: Kherson Oblast
City/ Town/ Village: Kherson

The Shipbuilder Lyceum has been shelled, resulting in a fire. No casualties have been reported.",https://www.facebook.com/DSNSKHERSON/posts/pfbid0o8CPwkFaoby6drNq2bs4GDFw3EE9tb7ZBuT1wVVqB5NdVffg2P1Bd7vXqyNjdrFNl,Aerial and Artillery strikes targeting the civilian population,,#f65c60,True,,32.580525,46.610593,
Shelling of residential area,"Date of discovery: 05 February 2023
Province: Dnipropetrovsk Oblast
City/Town/Village: Marhanets

At 11:00 p.m., a village near Marhanets has been shelled by artillery. This resulted in damage to a farm's warehouse and further damage to residential buildings and power lines.",https://www.facebook.com/PoliceDniproRegion/posts/pfbid05uNTteWkTW7B3Q8CPd7LK3arUmsETMmE3tth5TiERuGpBjdJSbLSjQjDjakA9e2Jl,Aerial and Artillery strikes targeting the civilian population,,#f65c60,True,,34.653744,47.640463,
Shelling of residential area,"Date of discovery: 05 February 2023
Province: Zaporizhzhia Oblast
City/Town/Village: Prymorske

Shelling results in damage to 3 houses.",https://zp.npu.gov.ua/news/novi-ruinuvannia-tsyvilnoi-infrastruktury-na-zaporizhzhi-politsiia-zadokumentuvala-naslidky-vorozhykh-obstriliv,Aerial and Artillery strikes targeting the civilian population,,#f65c60,True,,35.288921,47.626369,
Okhtyrka City Council destroyed,"Date of discovery: 08 March 2022
City/ Town/ Village: Okhtyrka

Akhtyrka City Council destroyed.
https://news.yahoo.com/ukrainian-military-releases-video-says-210522906.html?",https://twitter.com/SputnikATO/status/1501184212203941897,Aerial and Artillery strikes targeting the civilian population,,#f65c60,True,,34.893434,50.304197,
Artillery shelling of residential area,"Date of discovery: 07 February 2023
City/ Town/ Village: Avdiivka

The city has been shelled 26 times by ''Grad'' and other types of artillery. The workshop of the plant, the premises of the enterprise, commercial buildings, and a house were destroyed. One civilian has been wounded.",https://dn.npu.gov.ua/news/27-udariv-po-myrnomu-naselenniu-viiska-rf-atakuvaly-donechchynu,Aerial and Artillery strikes targeting the civilian population,,#f65c60,True,,37.710675,48.159322,
Shelling of residential area,"Date of discovery: 06 February 2023
Province: Dnipropetrovsk Oblast
City/Town/Village: Myrivske

The city has been shelled by artillery. 3 residential buildings and 3 farm houses were damaged, as well as cars, gas pipelines, and electricity networks. No casualties have been reported.",https://t.me/mykola_lukashuk/3413,Aerial and Artillery strikes targeting the civilian population,,#f65c60,True,,33.396921,48.087908,
Shelling of residential areas,"Date of discovery: 07 February 2023
Province: Donetsk Oblast
City/Town/Village: Volnovakha

Shelling from the direction of Vuhledar leads to damage of 5 residential buildings.",https://www.facebook.com/pavlokyrylenko.donoda/posts/pfbid0k6b88oCPLqwvc2wSYpGzAG8kRHfZxNZxS7KMAXWhhSdbtJut9dcPTtbPH74bqZXSl,Aerial and Artillery strikes targeting the civilian population,,#f65c60,True,,37.508224,47.597157,
Strike on a residential area,"Date of discovery: 01 January 2023
City/ Town/ Village: Ochakiv

Strike on a residential sector, and one of the shells also hit the building of the 22nd state fire and rescue unit. In the subdivision, windows were blown out, the roof of the building was destroyed, and the covering of the garage was blown out.",https://www.facebook.com/DSNSMYKOL/posts/pfbid02G1NTfepQMgGwe8LTVKAX3w4aWnvYQrCHF6Zf85jKJz3t2XgdeUtN7SfLEcNuEzQ8l,Aerial and Artillery strikes targeting the civilian population,,#f65c60,True,,31.5411,46.621474,
Shelling of University of Urban Economy,"Date of discovery: 05 February 2023
Province: Kharkiv Oblast
City/Town/Village: Kharkiv

The university has been damaged by missile strikes. One of the university buildings received significant damage on the fourth and fifth floors.
https://t.me/h_saltovka/71204",https://www.facebook.com/DSNSKHARKIV/posts/pfbid0ZkVuhc1VeDA1eHcizNdRDRuSFQRbRQmhnb9fTP45TxTLw5WsqfsYxTrWKL8naYal,Aerial and Artillery strikes targeting the civilian population,,#f65c60,True,,36.243486,49.995209,https://maphub.net/media/images/l/k7/lk72y8bypuhedcqq/1344_1008.jpg
Rocket salvo on Marhanets,"Date of discovery: 05 February 2023
Province: Dnipropetrovsk Oblast
City/Town/Village: Marhanets

Rocket salvo systems have fired on the city, thereby damaging the local powerlines.",https://www.facebook.com/PoliceDniproRegion/posts/pfbid0vVY9AVT12vSDagpz6EgwUTm72yMS4DCScQFj3M6X3qRFKkE7gK5siaUPsHiv6MQpl,Aerial and Artillery strikes targeting the civilian population,,#f65c60,True,,34.641019,47.637791,
Medical institution damaged during shelling,"Date of discovery: 06 February 2023
City/Town/Village: Vovchansk

As a result of several shellings, a medical institution was damaged and a fire broke out. No casualties have been reported.",https://www.facebook.com/story.php?story_fbid=pfbid0T4TP5piTcmAt5a2gYAyvYBhWVwJ61PpJcD16aZGnYCzwsncj5jrbgJZMMa7yc22Jl&id=100077671360345,Aerial and Artillery strikes targeting the civilian population,,#f65c60,True,,36.930684,50.288486,
Shelling of residential area,"Date of discovery:06 February 2023
City/ Town/ Village: Kupiansk

The city has been shelled by artillery and anti-aircraft missiles. Residential houses as well as farm buildings and a car were damaged. No casualties have been reported.",https://www.facebook.com/prokuraturakharkiv/posts/pfbid0fYJNK76grLCUQdW8DhmYV3LudQ7xUofNjqBN4zyzLAjjbVycYruPVy4X6613xZBgl,Aerial and Artillery strikes targeting the civilian population,,#f65c60,True,,37.613592,49.698003,
Church damaged due to shelling,"Date of discovery: 08 February 2023
Province: Dnipropetrovsk oblast
City/Town/Village: Chervonohryhorivka

Barreled artillery has struck the village, thereby partially destroying the local church and damaging a local monument.",https://www.facebook.com/PoliceDniproRegion/posts/pfbid0kp67bozk8Kn83BkYmurLccS3DUDskeVH113UNf652b6Tf1uh4sHVvGWnuugfjRhZl,Aerial and Artillery strikes targeting the civilian population,,#f65c60,True,,34.523444,47.620643,
Shelling of Gorky Central Park,"Date of discovery: 08 February 2023
Province: Kharkiv Oblast
City/Town/Village: Kharkiv 

The Central Park has been shelled during the night. No casualties have been reported.",https://t.me/ihor_terekhov/597,Aerial and Artillery strikes targeting the civilian population,,#f65c60,True,,36.247869,50.017591,https://maphub.net/media/images/m/7a/m7a9u41vxtjlvbq6/1344_1008.jpg
Shelling of industrial facility,"Date of discovery: 08 February 2023
Province: Kharkiv Oblast
City/Town/Village: Kharkiv 

Four S-300 missiles fell on the local industrial facility, thereby destroying several buildings and causing a large-scale fire. The Central Park has also been hit in the attack. No casualties have been reported.",https://t.me/synegubov/5512,Aerial and Artillery strikes targeting the civilian population,,#f65c60,True,,36.23101,50.01693,https://maphub.net/media/images/p/lk/plkzrz8vuipw17ll/768_576.jpg
Shelling results in death and wounding of civilians,"Date of discovery: 08 February 2023
City/Town/Village: Vovchansk

Artillery shelling wounded a 16-year-old girl and caused the death of an elderly woman. The shelling has also damaged the local hospital which caused a fire. An ambulance transferring a patient was also been hit, however, this did not result in casualties.",https://t.me/synegubov/5512,Aerial and Artillery strikes targeting the civilian population,,#f65c60,True,,36.933277,50.288352,
Shelling of residential area results in fire,"Date of discovery: 08 February 2023
Region: Kharkiv Oblast
City/ Town/ Village: Kupyansk

Shelling destroys 6 garages and damages an additional 10. Fires broke out. No casualties have been reported.",https://t.me/synegubov/5512,Aerial and Artillery strikes targeting the civilian population,,#f65c60,True,,37.610104,49.710054,
Heavy shelling of residential area,"Date of discovery: 07 February 2023
Province: Dnipropetrovsk Oblast
City/Town/Village: Marhanets

The city has been heavily shelled by heavy artillery and MLRS systems. Due to the shelling, power lines were cut off which resulted in a water pumping station being cut off. As a result, nine settlements were without water which is approximately 60.000 people. Additionally, four residential buildings, a farm building, electricity networks, and gas pipelines have been damaged. No causalties have been reported.",https://www.facebook.com/MVLukashuk/posts/pfbid02KdBbV2jCDHK42jpK2uBqyWQMXvdkAnw5RytChH6LRQkVVBsbWF9Xg6CPs4NR5EqWl,Aerial and Artillery strikes targeting the civilian population,,#f65c60,True,,34.64671,47.645238,
